{
  "$schema": "../encounter.schema.json",
  "skipChance": 0.25,
  "minTypesAtLow": 1,
  "maxTypesAtHigh": 3,
  "entries": [
    { "bandit": "Human_Bandit_RuinKasern_01", "minLevel": 20, "maxLevel": 40, "weight": 2.0, "baseCount": 2, "countGrowth": 3 },
    { "bandit": "Human_Bandit_RuinKasern_02", "minLevel": 20, "maxLevel": 40, "weight": 1.5, "baseCount": 2, "countGrowth": 3 },
    { "bandit": "Human_Bandit_RuinKasern_03", "minLevel": 20, "maxLevel": 40, "weight": 1.0, "baseCount": 1, "countGrowth": 2 }
  ]
}
