{
  "$schema": "../encounter.schema.json",
  "skipChance": 0.25,
  "minTypesAtLow": 1,
  "maxTypesAtHigh": 3,
  "entries": [
    { "creature": "Boar",    "minLevel": 6, "maxLevel": 20, "weight": 2.0, "baseCount": 1, "countGrowth": 2 },
    { "creature": "Snapper", "minLevel": 1, "maxLevel": 30, "weight": 1.0, "baseCount": 1, "countGrowth": 2 },
    { "creature": "Spitter", "minLevel": 8, "maxLevel": 30, "weight": 1.0, "baseCount": 1, "countGrowth": 2 }
  ]
}
