{
  "$schema": "../encounter.schema.json",
  "skipChance": 0.25,
  "minTypesAtLow": 1,
  "maxTypesAtHigh": 3,
  "entries": [
    { "creature": "Draugr_Axe",          "minLevel": 15, "maxLevel": 30, "weight": 1.5, "baseCount": 1, "countGrowth": 3 },
    { "creature": "Draugr_Mage",         "minLevel": 15, "maxLevel": 35, "weight": 1.0, "baseCount": 1, "countGrowth": 3 },
    { "creature": "Draugr_Spear",        "minLevel": 15, "maxLevel": 32, "weight": 1.0, "baseCount": 1, "countGrowth": 3 },
    { "creature": "Draugr_Sword_Shield", "minLevel": 15, "maxLevel": 35, "weight": 0.8, "baseCount": 1, "countGrowth": 3 }
  ]
}
